<Clothes xmlns:xsi="http://www.w3.org/2001/XMLSchema-instance" xsi:noNamespaceSchemaLocation="Clothes.xsd">
  <ClothingData Class="Game.ClothingData" Index="32" DisplayName="[ClothingBlock:32]" Description="[ClothingBlock:32]" Slot="Head" ArmorProtection="0.1" Sturdiness="25" Insulation="4.0" MovementSpeedFactor="1" SteedMovementSpeedFactor="1" DensityModifier="0.0" IsOuter="True" CanBeDyed="True" Layer="1" PlayerLevelRequired="1" TextureName="Textures/Clothing/OldHat" ImpactSoundsFolder="Audio/Impacts/Soft" />
  <ClothingData Class="Game.ClothingData" Index="37" DisplayName="[ClothingBlock:37]" Description="[ClothingBlock:37]" Slot="Torso" ArmorProtection="0.1" Sturdiness="25" Insulation="1.0" MovementSpeedFactor="1" SteedMovementSpeedFactor="1" DensityModifier="0.0" IsOuter="False" CanBeDyed="True" Layer="0" PlayerLevelRequired="1" TextureName="Textures/Clothing/OldTankTop" ImpactSoundsFolder="" />
  <ClothingData Class="Game.ClothingData" Index="1" DisplayName="[ClothingBlock:1]" Description="[ClothingBlock:1]" Slot="Torso" ArmorProtection="0.1" Sturdiness="25" Insulation="2.0" MovementSpeedFactor="1" SteedMovementSpeedFactor="1" DensityModifier="0.0" IsOuter="False" CanBeDyed="True" Layer="1" PlayerLevelRequired="1" TextureName="Textures/Clothing/OldShirt" ImpactSoundsFolder="" />
  <ClothingData Class="Game.ClothingData" Index="0" DisplayName="[ClothingBlock:0]" Description="[ClothingBlock:0]" Slot="Legs" ArmorProtection="0.1" Sturdiness="25" Insulation="2.0" MovementSpeedFactor="1" SteedMovementSpeedFactor="1" DensityModifier="0.0" IsOuter="False" CanBeDyed="True" Layer="1" PlayerLevelRequired="1" TextureName="Textures/Clothing/OldPants" ImpactSoundsFolder="" />

  <ClothingData Class="Game.ClothingData" Index="30" DisplayName="[ClothingBlock:30]" Description="[ClothingBlock:30]" Slot="Head" ArmorProtection="0.1" Sturdiness="25" Insulation="4.0" MovementSpeedFactor="1" SteedMovementSpeedFactor="1" DensityModifier="0.0" IsOuter="True" CanBeDyed="True" Layer="1" PlayerLevelRequired="1" TextureName="Textures/Clothing/CottonFedora" ImpactSoundsFolder="Audio/Impacts/Soft" />
  <ClothingData Class="Game.ClothingData" Index="13" DisplayName="[ClothingBlock:13]" Description="[ClothingBlock:13]" Slot="Torso" ArmorProtection="0.1" Sturdiness="25" Insulation="4.0" MovementSpeedFactor="1" SteedMovementSpeedFactor="1" DensityModifier="0.0" IsOuter="False" CanBeDyed="True" Layer="1" PlayerLevelRequired="1" TextureName="Textures/Clothing/CottonShirt" ImpactSoundsFolder="" />
  <ClothingData Class="Game.ClothingData" Index="14" DisplayName="[ClothingBlock:14]" Description="[ClothingBlock:14]" Slot="Torso" ArmorProtection="0.1" Sturdiness="25" Insulation="2.0" MovementSpeedFactor="1" SteedMovementSpeedFactor="1" DensityModifier="0.0" IsOuter="False" CanBeDyed="True" Layer="0" PlayerLevelRequired="1" TextureName="Textures/Clothing/CottonTShirt" ImpactSoundsFolder="" />
  <ClothingData Class="Game.ClothingData" Index="15" DisplayName="[ClothingBlock:15]" Description="[ClothingBlock:15]" Slot="Torso" ArmorProtection="0.1" Sturdiness="25" Insulation="1.0" MovementSpeedFactor="1" SteedMovementSpeedFactor="1" DensityModifier="0.0" IsOuter="False" CanBeDyed="True" Layer="0" PlayerLevelRequired="1" TextureName="Textures/Clothing/CottonTankTop" ImpactSoundsFolder="" />
  <ClothingData Class="Game.ClothingData" Index="16" DisplayName="[ClothingBlock:16]" Description="[ClothingBlock:16]" Slot="Legs" ArmorProtection="0.1" Sturdiness="25" Insulation="4.0" MovementSpeedFactor="1" SteedMovementSpeedFactor="1" DensityModifier="0.0" IsOuter="False" CanBeDyed="True" Layer="1" PlayerLevelRequired="1" TextureName="Textures/Clothing/CottonPants" ImpactSoundsFolder="" />
  <ClothingData Class="Game.ClothingData" Index="17" DisplayName="[ClothingBlock:17]" Description="[ClothingBlock:17]" Slot="Legs" ArmorProtection="0.1" Sturdiness="25" Insulation="1.0" MovementSpeedFactor="1" SteedMovementSpeedFactor="1" DensityModifier="0.0" IsOuter="False" CanBeDyed="True" Layer="1" PlayerLevelRequired="1" TextureName="Textures/Clothing/CottonShorts" ImpactSoundsFolder="" />

  <ClothingData Class="Game.ClothingData" Index="24" DisplayName="[ClothingBlock:24]" Description="[ClothingBlock:24]" Slot="Torso" ArmorProtection="0.1" Sturdiness="25" Insulation="12.0" MovementSpeedFactor="1" SteedMovementSpeedFactor="1" DensityModifier="0.0" IsOuter="True" CanBeDyed="True" Layer="2" PlayerLevelRequired="1" TextureName="Textures/Clothing/CottonSweater" ImpactSoundsFolder="" />
  <ClothingData Class="Game.ClothingData" Index="25" DisplayName="[ClothingBlock:25]" Description="[ClothingBlock:25]" Slot="Legs" ArmorProtection="0.1" Sturdiness="25" Insulation="12.0" MovementSpeedFactor="1" SteedMovementSpeedFactor="1" DensityModifier="0.0" IsOuter="False" CanBeDyed="True" Layer="0" PlayerLevelRequired="1" TextureName="Textures/Clothing/CottonLongJohns" ImpactSoundsFolder="" />
  <ClothingData Class="Game.ClothingData" Index="26" DisplayName="[ClothingBlock:26]" Description="[ClothingBlock:26]" Slot="Feet" ArmorProtection="0.1" Sturdiness="25" Insulation="8.0" MovementSpeedFactor="1" SteedMovementSpeedFactor="1" DensityModifier="0.0" IsOuter="False" CanBeDyed="True" Layer="0" PlayerLevelRequired="1" TextureName="Textures/Clothing/CottonSocks" ImpactSoundsFolder="" />

  <ClothingData Class="Game.ClothingData" Index="31" DisplayName="[ClothingBlock:31]" Description="[ClothingBlock:31]" Slot="Head" ArmorProtection="0.5" Sturdiness="40" Insulation="8.0" MovementSpeedFactor="1" SteedMovementSpeedFactor="1" DensityModifier="0.0" IsOuter="True" CanBeDyed="True" Layer="1" PlayerLevelRequired="1" TextureName="Textures/Clothing/LeatherCowboyHat" ImpactSoundsFolder="Audio/Impacts/Soft" />
  <ClothingData Class="Game.ClothingData" Index="11" DisplayName="[ClothingBlock:11]" Description="[ClothingBlock:11]" Slot="Head" ArmorProtection="0.5" Sturdiness="40" Insulation="8.0" MovementSpeedFactor="1" SteedMovementSpeedFactor="1" DensityModifier="0.0" IsOuter="True" CanBeDyed="True" Layer="1" PlayerLevelRequired="1" TextureName="Textures/Clothing/LeatherHat" ImpactSoundsFolder="Audio/Impacts/Soft" />
  <ClothingData Class="Game.ClothingData" Index="5" DisplayName="[ClothingBlock:5]" Description="[ClothingBlock:5]" Slot="Torso" ArmorProtection="0.5" Sturdiness="40" Insulation="4.0" MovementSpeedFactor="1" SteedMovementSpeedFactor="1" DensityModifier="0.0" IsOuter="False" CanBeDyed="True" Layer="2" PlayerLevelRequired="1" TextureName="Textures/Clothing/LeatherJerkin" ImpactSoundsFolder="Audio/Impacts/Soft" />
  <ClothingData Class="Game.ClothingData" Index="12" DisplayName="[ClothingBlock:12]" Description="[ClothingBlock:12]" Slot="Legs" ArmorProtection="0.5" Sturdiness="40" Insulation="4.0" MovementSpeedFactor="1" SteedMovementSpeedFactor="1" DensityModifier="0.0" IsOuter="False" CanBeDyed="True" Layer="1" PlayerLevelRequired="1" TextureName="Textures/Clothing/LeatherPants" ImpactSoundsFolder="Audio/Impacts/Soft" />
  <ClothingData Class="Game.ClothingData" Index="29" DisplayName="[ClothingBlock:29]" Description="[ClothingBlock:29]" Slot="Feet" ArmorProtection="0.5" Sturdiness="20" Insulation="8.0" MovementSpeedFactor="1.2" SteedMovementSpeedFactor="1" DensityModifier="0.0" IsOuter="True" CanBeDyed="True" Layer="1" PlayerLevelRequired="1" TextureName="Textures/Clothing/LeatherSandals" ImpactSoundsFolder="Audio/Impacts/Soft" />
  <ClothingData Class="Game.ClothingData" Index="8" DisplayName="[ClothingBlock:8]" Description="[ClothingBlock:8]" Slot="Feet" ArmorProtection="0.5" Sturdiness="40" Insulation="12.0" MovementSpeedFactor="1.25" SteedMovementSpeedFactor="1" DensityModifier="0.0" IsOuter="True" CanBeDyed="True" Layer="1" PlayerLevelRequired="1" TextureName="Textures/Clothing/LeatherBoots" ImpactSoundsFolder="Audio/Impacts/Soft" />
  <ClothingData Class="Game.ClothingData" Index="27" DisplayName="[ClothingBlock:27]" Description="[ClothingBlock:27]" Slot="Feet" ArmorProtection="0.75" Sturdiness="60" Insulation="16.0" MovementSpeedFactor="1.25" SteedMovementSpeedFactor="1.05" DensityModifier="0.0" IsOuter="True" CanBeDyed="False" Layer="1" PlayerLevelRequired="1" TextureName="Textures/Clothing/CavalryBoots" ImpactSoundsFolder="Audio/Impacts/Soft" />

  <ClothingData Class="Game.ClothingData" Index="18" DisplayName="[ClothingBlock:18]" Description="[ClothingBlock:18]" Slot="Head" ArmorProtection="0.25" Sturdiness="30" Insulation="16.0" MovementSpeedFactor="1" SteedMovementSpeedFactor="1" DensityModifier="0.0" IsOuter="True" CanBeDyed="True" Layer="1" PlayerLevelRequired="1" TextureName="Textures/Clothing/FurHat" ImpactSoundsFolder="Audio/Impacts/Soft" />
  <ClothingData Class="Game.ClothingData" Index="6" DisplayName="[ClothingBlock:6]" Description="[ClothingBlock:6]" Slot="Torso" ArmorProtection="0.25" Sturdiness="30" Insulation="16.0" MovementSpeedFactor="0.95" SteedMovementSpeedFactor="1" DensityModifier="0.0" IsOuter="True" CanBeDyed="True" Layer="4" PlayerLevelRequired="1" TextureName="Textures/Clothing/FurCoat" ImpactSoundsFolder="Audio/Impacts/Soft" />
  <ClothingData Class="Game.ClothingData" Index="7" DisplayName="[ClothingBlock:7]" Description="[ClothingBlock:7]" Slot="Legs" ArmorProtection="0.25" Sturdiness="30" Insulation="16.0" MovementSpeedFactor="0.95" SteedMovementSpeedFactor="1" DensityModifier="0.0" IsOuter="True" CanBeDyed="True" Layer="4" PlayerLevelRequired="1" TextureName="Textures/Clothing/FurLeggings" ImpactSoundsFolder="Audio/Impacts/Soft" />

  <ClothingData Class="Game.ClothingData" Index="23" DisplayName="[ClothingBlock:23]" Description="[ClothingBlock:23]" Slot="Torso" ArmorProtection="1.0" Sturdiness="15" Insulation="0.0" MovementSpeedFactor="1" SteedMovementSpeedFactor="1" DensityModifier="0.0" IsOuter="True" CanBeDyed="False" Layer="4" PlayerLevelRequired="1" TextureName="Textures/Clothing/WoodenChestPlate" ImpactSoundsFolder="Audio/Impacts/Wood" />